{"file_coupling":[{"file1":"api/openapi-spec/swagger.json","file2":"pkg/registry/admissionregistration/validatingadmissionpolicybinding/declarative_validation_test.go","co_changes":1,"coupling_strength":1},{"file1":"api/openapi-spec/swagger.json","file2":"pkg/api/testing/validation_test.go","co_changes":1,"coupling_strength":1},{"file1":"api/openapi-spec/swagger.json","file2":"staging/src/k8s.io/api/admissionregistration/v1/types.go","co_changes":1,"coupling_strength":1},{"file1":"api/openapi-spec/swagger.json","file2":"api/openapi-spec/v3/apis__admissionregistration.k8s.io__v1_openapi.json","co_changes":1,"coupling_strength":1},{"file1":"api/openapi-spec/swagger.json","file2":"staging/src/k8s.io/api/admissionregistration/v1alpha1/generated.proto","co_changes":1,"coupling_strength":1},{"file1":"api/openapi-spec/swagger.json","file2":"staging/src/k8s.io/api/admissionregistration/v1alpha1/types.go","co_changes":1,"coupling_strength":1},{"file1":"api/openapi-spec/swagger.json","file2":"staging/src/k8s.io/api/admissionregistration/v1/generated.proto","co_changes":1,"coupling_strength":1},{"file1":"api/openapi-spec/swagger.json","file2":"staging/src/k8s.io/api/admissionregistration/v1beta1/generated.proto","co_changes":1,"coupling_strength":1},{"file1":"api/openapi-spec/swagger.json","file2":"staging/src/k8s.io/api/admissionregistration/v1beta1/types.go","co_changes":1,"coupling_strength":1},{"file1":"api/openapi-spec/swagger.json","file2":"pkg/apis/admissionregistration/validation/validation.go","co_changes":1,"coupling_strength":1},{"file1":"api/openapi-spec/v3/apis__admissionregistration.k8s.io__v1_openapi.json","file2":"pkg/api/testing/validation_test.go","co_changes":1,"coupling_strength":1},{"file1":"api/openapi-spec/v3/apis__admissionregistration.k8s.io__v1_openapi.json","file2":"staging/src/k8s.io/api/admissionregistration/v1alpha1/types.go","co_changes":1,"coupling_strength":1},{"file1":"api/openapi-spec/v3/apis__admissionregistration.k8s.io__v1_openapi.json","file2":"pkg/apis/admissionregistration/validation/validation.go","co_changes":1,"coupling_strength":1},{"file1":"api/openapi-spec/v3/apis__admissionregistration.k8s.io__v1_openapi.json","file2":"staging/src/k8s.io/api/admissionregistration/v1beta1/types.go","co_changes":1,"coupling_strength":1},{"file1":"api/openapi-spec/v3/apis__admissionregistration.k8s.io__v1_openapi.json","file2":"staging/src/k8s.io/api/admissionregistration/v1beta1/generated.proto","co_changes":1,"coupling_strength":1},{"file1":"api/openapi-spec/v3/apis__admissionregistration.k8s.io__v1_openapi.json","file2":"staging/src/k8s.io/api/admissionregistration/v1/types.go","co_changes":1,"coupling_strength":1},{"file1":"api/openapi-spec/v3/apis__admissionregistration.k8s.io__v1_openapi.json","file2":"staging/src/k8s.io/api/admissionregistration/v1alpha1/generated.proto","co_changes":1,"coupling_strength":1},{"file1":"api/openapi-spec/v3/apis__admissionregistration.k8s.io__v1_openapi.json","file2":"staging/src/k8s.io/api/admissionregistration/v1/generated.proto","co_changes":1,"coupling_strength":1},{"file1":"api/openapi-spec/v3/apis__admissionregistration.k8s.io__v1_openapi.json","file2":"pkg/registry/admissionregistration/validatingadmissionpolicybinding/declarative_validation_test.go","co_changes":1,"coupling_strength":1},{"file1":"pkg/api/testing/validation_test.go","file2":"staging/src/k8s.io/api/admissionregistration/v1alpha1/types.go","co_changes":1,"coupling_strength":1},{"file1":"pkg/api/testing/validation_test.go","file2":"staging/src/k8s.io/api/admissionregistration/v1beta1/types.go","co_changes":1,"coupling_strength":1},{"file1":"pkg/api/testing/validation_test.go","file2":"pkg/apis/admissionregistration/validation/validation.go","co_changes":1,"coupling_strength":1},{"file1":"pkg/api/testing/validation_test.go","file2":"pkg/registry/admissionregistration/validatingadmissionpolicybinding/declarative_validation_test.go","co_changes":1,"coupling_strength":1},{"file1":"pkg/api/testing/validation_test.go","file2":"staging/src/k8s.io/api/admissionregistration/v1alpha1/generated.proto","co_changes":1,"coupling_strength":1},{"file1":"pkg/api/testing/validation_test.go","file2":"staging/src/k8s.io/api/admissionregistration/v1/generated.proto","co_changes":1,"coupling_strength":1},{"file1":"pkg/api/testing/validation_test.go","file2":"staging/src/k8s.io/api/admissionregistration/v1beta1/generated.proto","co_changes":1,"coupling_strength":1},{"file1":"pkg/api/testing/validation_test.go","file2":"staging/src/k8s.io/api/admissionregistration/v1/types.go","co_changes":1,"coupling_strength":1},{"file1":"pkg/apis/admissionregistration/validation/validation.go","file2":"staging/src/k8s.io/api/admissionregistration/v1beta1/generated.proto","co_changes":1,"coupling_strength":1},{"file1":"pkg/apis/admissionregistration/validation/validation.go","file2":"staging/src/k8s.io/api/admissionregistration/v1beta1/types.go","co_changes":1,"coupling_strength":1},{"file1":"pkg/apis/admissionregistration/validation/validation.go","file2":"staging/src/k8s.io/api/admissionregistration/v1/generated.proto","co_changes":1,"coupling_strength":1},{"file1":"pkg/apis/admissionregistration/validation/validation.go","file2":"pkg/registry/admissionregistration/validatingadmissionpolicybinding/declarative_validation_test.go","co_changes":1,"coupling_strength":1},{"file1":"pkg/apis/admissionregistration/validation/validation.go","file2":"staging/src/k8s.io/api/admissionregistration/v1alpha1/generated.proto","co_changes":1,"coupling_strength":1},{"file1":"pkg/apis/admissionregistration/validation/validation.go","file2":"staging/src/k8s.io/api/admissionregistration/v1/types.go","co_changes":1,"coupling_strength":1},{"file1":"pkg/apis/admissionregistration/validation/validation.go","file2":"staging/src/k8s.io/api/admissionregistration/v1alpha1/types.go","co_changes":1,"coupling_strength":1},{"file1":"pkg/registry/admissionregistration/validatingadmissionpolicybinding/declarative_validation_test.go","file2":"staging/src/k8s.io/api/admissionregistration/v1beta1/types.go","co_changes":1,"coupling_strength":1},{"file1":"pkg/registry/admissionregistration/validatingadmissionpolicybinding/declarative_validation_test.go","file2":"staging/src/k8s.io/api/admissionregistration/v1beta1/generated.proto","co_changes":1,"coupling_strength":1},{"file1":"pkg/registry/admissionregistration/validatingadmissionpolicybinding/declarative_validation_test.go","file2":"staging/src/k8s.io/api/admissionregistration/v1/generated.proto","co_changes":1,"coupling_strength":1},{"file1":"pkg/registry/admissionregistration/validatingadmissionpolicybinding/declarative_validation_test.go","file2":"staging/src/k8s.io/api/admissionregistration/v1/types.go","co_changes":1,"coupling_strength":1},{"file1":"pkg/registry/admissionregistration/validatingadmissionpolicybinding/declarative_validation_test.go","file2":"staging/src/k8s.io/api/admissionregistration/v1alpha1/types.go","co_changes":1,"coupling_strength":1},{"file1":"pkg/registry/admissionregistration/validatingadmissionpolicybinding/declarative_validation_test.go","file2":"staging/src/k8s.io/api/admissionregistration/v1alpha1/generated.proto","co_changes":1,"coupling_strength":1},{"file1":"staging/src/k8s.io/api/admissionregistration/v1/generated.proto","file2":"staging/src/k8s.io/api/admissionregistration/v1beta1/generated.proto","co_changes":1,"coupling_strength":1},{"file1":"staging/src/k8s.io/api/admissionregistration/v1/generated.proto","file2":"staging/src/k8s.io/api/admissionregistration/v1beta1/types.go","co_changes":1,"coupling_strength":1},{"file1":"staging/src/k8s.io/api/admissionregistration/v1/generated.proto","file2":"staging/src/k8s.io/api/admissionregistration/v1/types.go","co_changes":1,"coupling_strength":1},{"file1":"staging/src/k8s.io/api/admissionregistration/v1/generated.proto","file2":"staging/src/k8s.io/api/admissionregistration/v1alpha1/generated.proto","co_changes":1,"coupling_strength":1},{"file1":"staging/src/k8s.io/api/admissionregistration/v1/generated.proto","file2":"staging/src/k8s.io/api/admissionregistration/v1alpha1/types.go","co_changes":1,"coupling_strength":1},{"file1":"staging/src/k8s.io/api/admissionregistration/v1/types.go","file2":"staging/src/k8s.io/api/admissionregistration/v1alpha1/generated.proto","co_changes":1,"coupling_strength":1},{"file1":"staging/src/k8s.io/api/admissionregistration/v1/types.go","file2":"staging/src/k8s.io/api/admissionregistration/v1beta1/types.go","co_changes":1,"coupling_strength":1},{"file1":"staging/src/k8s.io/api/admissionregistration/v1/types.go","file2":"staging/src/k8s.io/api/admissionregistration/v1beta1/generated.proto","co_changes":1,"coupling_strength":1},{"file1":"staging/src/k8s.io/api/admissionregistration/v1/types.go","file2":"staging/src/k8s.io/api/admissionregistration/v1alpha1/types.go","co_changes":1,"coupling_strength":1},{"file1":"staging/src/k8s.io/api/admissionregistration/v1alpha1/generated.proto","file2":"staging/src/k8s.io/api/admissionregistration/v1beta1/generated.proto","co_changes":1,"coupling_strength":1},{"file1":"staging/src/k8s.io/api/admissionregistration/v1alpha1/generated.proto","file2":"staging/src/k8s.io/api/admissionregistration/v1beta1/types.go","co_changes":1,"coupling_strength":1},{"file1":"staging/src/k8s.io/api/admissionregistration/v1alpha1/generated.proto","file2":"staging/src/k8s.io/api/admissionregistration/v1alpha1/types.go","co_changes":1,"coupling_strength":1},{"file1":"staging/src/k8s.io/api/admissionregistration/v1alpha1/types.go","file2":"staging/src/k8s.io/api/admissionregistration/v1beta1/generated.proto","co_changes":1,"coupling_strength":1},{"file1":"staging/src/k8s.io/api/admissionregistration/v1alpha1/types.go","file2":"staging/src/k8s.io/api/admissionregistration/v1beta1/types.go","co_changes":1,"coupling_strength":1},{"file1":"staging/src/k8s.io/api/admissionregistration/v1beta1/generated.proto","file2":"staging/src/k8s.io/api/admissionregistration/v1beta1/types.go","co_c